{
  "version": 1,
  "packetVersion": "v2",
  "packetId": "pm_loop_default",
  "exportedAt": "2026-02-23T18:55:09.996267+00:00",
  "exportedBy": "pm-agent",
  "exportScope": "team",
  "exportReason": "pm_loop_cycle",
  "sources": [
    {
      "id": "SRC-002",
      "type": "link",
      "uri": "https://arceus.local/pm-loop",
      "title": "",
      "scope": "",
      "hash": "c9aa70ea1716f8505f7b179a5c6a64ca638347bb81d8f559c5a75d0a71accb60",
      "citedInDecisions": []
    }
  ],
  "decisions": [
    {
      "id": "DEC-002",
      "title": "Cycle 2 recommendation",
      "decidedAt": "2026-02-23T18:55:09.995565+00:00",
      "owner": "pm-agent",
      "evidenceIds": []
    }
  ]
}
